{
 "schema_version": "1.0",
 "sector": "healthcare",
 "step_library": "step_library.json",
 "rules": [
  {
   "id": "R-icra-zone",
   "description": "Zones next to the live hospital get an ICRA barrier, HEPA clean and clearance. Not chained: dependencies come from step predecessors (same_zone).",
   "priority": 400,
   "match": {
    "ifc_class": [
     "IfcSlab"
    ],
    "zone_tags_any": [
     "occupied_adjacent"
    ]
   },
   "steps": [
    {
     "step": "GEN-ICRA-SETUP",
     "quantity": "count",
     "min_quantity": 1
    },
    {
     "step": "GEN-HEPA-CLEAN",
     "quantity": "area_m2",
     "min_quantity": 1
    },
    {
     "step": "GEN-ICRA-CLOSEOUT",
     "quantity": "count",
     "min_quantity": 1
    }
   ],
   "continue": true,
   "chain": false,
   "visual": "slab"
  },
  {
   "id": "R-mri",
   "description": "MRI: 26 week lead, shielded room first.",
   "priority": 395,
   "match": {
    "ifc_class": [
     "IfcMedicalDevice"
    ],
    "name_regex": "(?i)(\\bMRI\\b|magnet|magnetic)"
   },
   "steps": [
    {
     "step": "MED-MRI-INSTALL",
     "quantity": "count",
     "min_quantity": 1
    },
    {
     "step": "GEN-HANDOVER-DOC",
     "quantity": "count",
     "min_quantity": 1
    }
   ],
   "visual": "equipment"
  },
  {
   "id": "R-ct",
   "description": "CT and imaging: 20 week lead, shielded room.",
   "priority": 390,
   "match": {
    "ifc_class": [
     "IfcMedicalDevice"
    ],
    "name_regex": "(?i)(\\bCT\\b|computed|scanner|x.?ray|radiograph|fluoro|angio)"
   },
   "steps": [
    {
     "step": "MED-CT-INSTALL",
     "quantity": "count",
     "min_quantity": 1
    },
    {
     "step": "GEN-HANDOVER-DOC",
     "quantity": "count",
     "min_quantity": 1
    }
   ],
   "visual": "equipment"
  },
  {
   "id": "R-steriliser",
   "description": "Sterilisers: 12 week lead, needs steam, water and gas.",
   "priority": 385,
   "match": {
    "ifc_class": [
     "IfcMedicalDevice"
    ],
    "name_regex": "(?i)(steril|autoclave|washer|cssd|disinfect)"
   },
   "steps": [
    {
     "step": "MED-STERIL-INSTALL",
     "quantity": "count",
     "min_quantity": 1
    },
    {
     "step": "GEN-HANDOVER-DOC",
     "quantity": "count",
     "min_quantity": 1
    }
   ],
   "visual": "equipment"
  },
  {
   "id": "R-medical-device",
   "description": "Other clinical equipment.",
   "priority": 380,
   "match": {
    "ifc_class": [
     "IfcMedicalDevice"
    ]
   },
   "steps": [
    {
     "step": "MED-EQUIP-INSTALL",
     "quantity": "count",
     "min_quantity": 1
    },
    {
     "step": "GEN-HANDOVER-DOC",
     "quantity": "count",
     "min_quantity": 1
    }
   ],
   "visual": "equipment"
  },
  {
   "id": "R-gas-pipe",
   "description": "Medical gas pipe (system_id MG-*): install, pressure test, certify.",
   "priority": 375,
   "match": {
    "ifc_class": [
     "IfcPipeSegment"
    ]
   },
   "steps": [
    {
     "step": "MED-GAS-PIPE-INSTALL",
     "quantity": "length_m"
    },
    {
     "step": "MED-GAS-TEST",
     "quantity": "length_m"
    },
    {
     "step": "MED-GAS-CERT",
     "quantity": "length_m"
    }
   ],
   "visual": "pipe",
   "system_prefix": "MG-"
  },
  {
   "id": "R-pipe-fire",
   "description": "Sprinkler mains (system_id FP-*): one head or drop per 2 m.",
   "priority": 370,
   "match": {
    "ifc_class": [
     "IfcPipeSegment"
    ]
   },
   "steps": [
    {
     "step": "FIR-SPRINK-INSTALL",
     "quantity": "length_m",
     "quantity_factor": 0.5,
     "unit_override": "ea"
    }
   ],
   "visual": "pipe",
   "system_prefix": "FP-"
  },
  {
   "id": "R-pipe-underground",
   "description": "Underground drainage under the ground slab.",
   "priority": 365,
   "match": {
    "ifc_class": [
     "IfcPipeSegment"
    ],
    "storey_index_max": -1
   },
   "steps": [
    {
     "step": "CIV-EARTH-CUT",
     "quantity": "length_m",
     "quantity_factor": 1.2,
     "unit_override": "m3"
    },
    {
     "step": "PLB-UG-INSTALL",
     "quantity": "length_m"
    }
   ],
   "visual": "pipe"
  },
  {
   "id": "R-pipe",
   "description": "Water, waste and heating pipe.",
   "priority": 360,
   "match": {
    "ifc_class": [
     "IfcPipeSegment"
    ]
   },
   "steps": [
    {
     "step": "PLB-PIPE-INSTALL",
     "quantity": "length_m"
    }
   ],
   "visual": "pipe"
  },
  {
   "id": "R-fitting",
   "description": "Fittings, chambers and similar.",
   "priority": 355,
   "match": {
    "ifc_class": [
     "IfcPipeFitting",
     "IfcDuctFitting",
     "IfcDistributionChamberElement"
    ]
   },
   "steps": [
    {
     "step": "MEP-FITTING-INSTALL",
     "quantity": "count",
     "min_quantity": 1
    }
   ],
   "visual": "pipe"
  },
  {
   "id": "R-duct",
   "description": "Ductwork.",
   "priority": 350,
   "match": {
    "ifc_class": [
     "IfcDuctSegment"
    ]
   },
   "steps": [
    {
     "step": "MEP-DUCT-INSTALL",
     "quantity": "length_m"
    }
   ],
   "visual": "duct"
  },
  {
   "id": "R-tray",
   "description": "Containment.",
   "priority": 345,
   "match": {
    "ifc_class": [
     "IfcCableCarrierSegment"
    ]
   },
   "steps": [
    {
     "step": "MEP-TRAY-INSTALL",
     "quantity": "length_m"
    }
   ],
   "visual": "cable_tray"
  },
  {
   "id": "R-cable",
   "description": "Cabling with electrical inspection.",
   "priority": 340,
   "match": {
    "ifc_class": [
     "IfcCableSegment"
    ]
   },
   "steps": [
    {
     "step": "ELE-CABLE-PULL",
     "quantity": "length_m"
    }
   ],
   "visual": "cable_tray"
  },
  {
   "id": "R-air-terminal-pressure",
   "description": "Pressure-controlled rooms (theatres, isolation): diffuser, balance, pressure test.",
   "priority": 335,
   "match": {
    "ifc_class": [
     "IfcAirTerminal"
    ],
    "zone_tags_any": [
     "pressure_room"
    ]
   },
   "steps": [
    {
     "step": "MEP-DIFFUSER-SET",
     "quantity": "count",
     "min_quantity": 1
    },
    {
     "step": "CX-AIR-BALANCE",
     "quantity": "count",
     "min_quantity": 1
    },
    {
     "step": "CX-PRESSURE-TEST",
     "quantity": "count",
     "min_quantity": 1
    }
   ],
   "visual": "terminal"
  },
  {
   "id": "R-air-terminal",
   "description": "Diffusers with air balancing.",
   "priority": 330,
   "match": {
    "ifc_class": [
     "IfcAirTerminal",
     "IfcFlowTerminal"
    ]
   },
   "steps": [
    {
     "step": "MEP-DIFFUSER-SET",
     "quantity": "count",
     "min_quantity": 1
    },
    {
     "step": "CX-AIR-BALANCE",
     "quantity": "count",
     "min_quantity": 1
    }
   ],
   "visual": "terminal"
  },
  {
   "id": "R-sanitary",
   "description": "Basins, WCs, sinks.",
   "priority": 325,
   "match": {
    "ifc_class": [
     "IfcSanitaryTerminal"
    ]
   },
   "steps": [
    {
     "step": "PLB-FIXTURE-SET",
     "quantity": "count",
     "min_quantity": 1
    }
   ],
   "visual": "terminal"
  },
  {
   "id": "R-sprinkler",
   "description": "Sprinkler heads and drops.",
   "priority": 320,
   "match": {
    "ifc_class": [
     "IfcFireSuppressionTerminal"
    ]
   },
   "steps": [
    {
     "step": "FIR-SPRINK-INSTALL",
     "quantity": "count",
     "min_quantity": 1
    }
   ],
   "visual": "terminal"
  },
  {
   "id": "R-light",
   "description": "Light fittings after ceiling.",
   "priority": 315,
   "match": {
    "ifc_class": [
     "IfcLightFixture",
     "IfcLamp"
    ]
   },
   "steps": [
    {
     "step": "ELE-LIGHT-INSTALL",
     "quantity": "count",
     "min_quantity": 1
    }
   ],
   "visual": "terminal"
  },
  {
   "id": "R-alarm",
   "description": "Detectors, alarms and controls with acceptance test.",
   "priority": 310,
   "match": {
    "ifc_class": [
     "IfcSensor",
     "IfcAlarm",
     "IfcActuator",
     "IfcController",
     "IfcUnitaryControlElement"
    ]
   },
   "steps": [
    {
     "step": "ELE-LIGHT-INSTALL",
     "quantity": "count",
     "min_quantity": 1
    },
    {
     "step": "CX-FIRE-TEST",
     "quantity": "count",
     "min_quantity": 1
    }
   ],
   "visual": "terminal"
  },
  {
   "id": "R-valve",
   "description": "Valves and dampers.",
   "priority": 305,
   "match": {
    "ifc_class": [
     "IfcFlowController"
    ]
   },
   "steps": [
    {
     "step": "MEP-FITTING-INSTALL",
     "quantity": "count",
     "min_quantity": 1
    }
   ],
   "visual": "generic"
  },
  {
   "id": "R-chiller",
   "description": "Chillers and boilers: 16 week lead.",
   "priority": 300,
   "match": {
    "ifc_class": [
     "IfcEnergyConversionDevice"
    ],
    "name_regex": "(?i)(chiller|boiler|heat.?pump|cooling)"
   },
   "steps": [
    {
     "step": "MEP-CHILLER-SET",
     "quantity": "count",
     "min_quantity": 1
    },
    {
     "step": "GEN-HANDOVER-DOC",
     "quantity": "count",
     "min_quantity": 1
    }
   ],
   "visual": "equipment"
  },
  {
   "id": "R-transformer",
   "description": "Transformer: 40 week lead.",
   "priority": 295,
   "match": {
    "ifc_class": [
     "IfcTransformer"
    ]
   },
   "steps": [
    {
     "step": "ELE-XFMR-SET",
     "quantity": "count",
     "min_quantity": 1
    },
    {
     "step": "CX-POWER-ENERGISE",
     "quantity": "count",
     "min_quantity": 1
    },
    {
     "step": "GEN-HANDOVER-DOC",
     "quantity": "count",
     "min_quantity": 1
    }
   ],
   "visual": "equipment"
  },
  {
   "id": "R-plant",
   "description": "AHUs, pumps, tanks: 12 week lead.",
   "priority": 290,
   "match": {
    "ifc_class": [
     "IfcFlowMovingDevice",
     "IfcFlowStorageDevice",
     "IfcEnergyConversionDevice"
    ]
   },
   "steps": [
    {
     "step": "MEP-AHU-SET",
     "quantity": "count",
     "min_quantity": 1
    },
    {
     "step": "GEN-HANDOVER-DOC",
     "quantity": "count",
     "min_quantity": 1
    }
   ],
   "visual": "equipment"
  },
  {
   "id": "R-switchgear",
   "description": "Main switchgear: 24 week lead.",
   "priority": 285,
   "match": {
    "ifc_class": [
     "IfcElectricDistributionBoard"
    ],
    "name_regex": "(?i)(switchgear|swgr|main|msb|\\bMV\\b|\\bLV\\b|ups|generator)"